{
  "schema": "swal.health/v1/workout-plan",
  "id": "01J00000000000000000000031",
  "subject": "subj_01J00000000000000000000000",
  "createdAt": "2026-10-02T18:00:00Z",
  "source": {
    "app": "training",
    "version": "0.1.0"
  },
  "gosDataset": "1.4.0+sha256:aaaaaaaaaaaaaaaaaaaaaaaaaaaaaaaaaaaaaaaaaaaaaaaaaaaaaaaaaaaaaaaa",
  "data": {
    "name": "Conditioning",
    "progression": "off",
    "exercises": [
      {
        "ref": "wg:running",
        "mode": "cardio",
        "sets": 1
      },
      {
        "ref": "wg:rowing-machine",
        "mode": "time",
        "sets": 4,
        "restSec": 90
      }
    ]
  }
}