{
  "schema": "swal.health/v1/meal-log",
  "id": "01J00000000000000000000002",
  "subject": "subj_01J00000000000000000000000",
  "createdAt": "2024-02-29T12:30:20.123+01:00",
  "source": {
    "app": "orionhealth",
    "version": "0.1.0"
  },
  "gosDataset": "1.4.0+sha256:aaaaaaaaaaaaaaaaaaaaaaaaaaaaaaaaaaaaaaaaaaaaaaaaaaaaaaaaaaaaaaaa",
  "data": {
    "consumedAt": "2026-10-02T18:00:00Z",
    "mealType": "lunch",
    "items": [
      {
        "ref": "gos:dish/colombian/ajiaco",
        "servings": 1
      },
      {
        "ref": "gos:ingredient/aguacate",
        "grams": 80
      }
    ],
    "nutrition": {
      "calories": 0,
      "protein_g": 0,
      "fat_g": 0,
      "carbs_g": 0,
      "fiber_g": 0,
      "sugar_g": 0,
      "micros": {
        "vitamin-c": 12
      }
    },
    "nutritionSource": "computed",
    "origin": {
      "app": "fize"
    }
  }
}
