{
  "schema": "swal.health/v1/workout-session",
  "id": "01J00000000000000000000001",
  "subject": "subj_01J00000000000000000000000",
  "createdAt": "2026-10-02T13:00:00-05:00",
  "source": { "app": "orionhealth", "version": "0.1.0" },
  "gosDataset": "1.4.0+sha256:aaaaaaaaaaaaaaaaaaaaaaaaaaaaaaaaaaaaaaaaaaaaaaaaaaaaaaaaaaaaaaaa",
  "data": {
    "startedAt": "2026-10-02T18:00:00Z",
    "endedAt": "2026-10-02T19:00:00Z",
    "exercises": [
      {
        "ref": "ex:barbell-bench-press",
        "sets": [
          { "reps": 8, "weightKg": 60, "rpe": 8 },
          { "durationS": 45 },
          { "distanceM": 400, "durationS": 120 }
        ]
      }
    ]
  }
}
