{
  "schema": "swal.health/v1/workout-plan",
  "id": "01J00000000000000000000030",
  "subject": "subj_01J00000000000000000000000",
  "createdAt": "2026-10-02T18:00:00Z",
  "source": {
    "app": "training",
    "version": "0.1.0"
  },
  "gosDataset": "1.4.0+sha256:aaaaaaaaaaaaaaaaaaaaaaaaaaaaaaaaaaaaaaaaaaaaaaaaaaaaaaaaaaaaaaaa",
  "data": {
    "name": "Pull A",
    "progression": "linear",
    "exercises": [
      {
        "ref": "wg:barbell-row",
        "sets": 4,
        "reps": 5,
        "weightKg": 70,
        "inc": 2.5
      },
      {
        "ref": "wg:barbell-curl",
        "sets": 3,
        "reps": 10
      }
    ]
  }
}